<?xml version="1.0" encoding="UTF-8" standalone="yes" ?>
<?codewarrior exportversion="1.0.1" ideversion="4.2" ?>

<!DOCTYPE PROJECT [
<!ELEMENT PROJECT (TARGETLIST, TARGETORDER, GROUPLIST, DESIGNLIST?)>
<!ELEMENT TARGETLIST (TARGET+)>
<!ELEMENT TARGET (NAME, SETTINGLIST, FILELIST?, LINKORDER?, SEGMENTLIST?, OVERLAYGROUPLIST?, SUBTARGETLIST?, SUBPROJECTLIST?, FRAMEWORKLIST)>
<!ELEMENT NAME (#PCDATA)>
<!ELEMENT USERSOURCETREETYPE (#PCDATA)>
<!ELEMENT PATH (#PCDATA)>
<!ELEMENT FILELIST (FILE*)>
<!ELEMENT FILE (PATHTYPE, PATHROOT?, ACCESSPATH?, PATH, PATHFORMAT?, ROOTFILEREF?, FILEKIND?, FILEFLAGS?)>
<!ELEMENT PATHTYPE (#PCDATA)>
<!ELEMENT PATHROOT (#PCDATA)>
<!ELEMENT ACCESSPATH (#PCDATA)>
<!ELEMENT PATHFORMAT (#PCDATA)>
<!ELEMENT ROOTFILEREF (PATHTYPE, PATHROOT?, ACCESSPATH?, PATH, PATHFORMAT?)>
<!ELEMENT FILEKIND (#PCDATA)>
<!ELEMENT FILEFLAGS (#PCDATA)>
<!ELEMENT FILEREF (TARGETNAME?, PATHTYPE, PATHROOT?, ACCESSPATH?, PATH, PATHFORMAT?)>
<!ELEMENT TARGETNAME (#PCDATA)>
<!ELEMENT SETTINGLIST ((SETTING|PANELDATA)+)>
<!ELEMENT SETTING (NAME?, (VALUE|(SETTING+)))>
<!ELEMENT PANELDATA (NAME, VALUE)>
<!ELEMENT VALUE (#PCDATA)>
<!ELEMENT LINKORDER (FILEREF*)>
<!ELEMENT SEGMENTLIST (SEGMENT+)>
<!ELEMENT SEGMENT (NAME, ATTRIBUTES?, FILEREF*)>
<!ELEMENT ATTRIBUTES (#PCDATA)>
<!ELEMENT OVERLAYGROUPLIST (OVERLAYGROUP+)>
<!ELEMENT OVERLAYGROUP (NAME, BASEADDRESS, OVERLAY*)>
<!ELEMENT BASEADDRESS (#PCDATA)>
<!ELEMENT OVERLAY (NAME, FILEREF*)>
<!ELEMENT SUBTARGETLIST (SUBTARGET+)>
<!ELEMENT SUBTARGET (TARGETNAME, ATTRIBUTES?, FILEREF?)>
<!ELEMENT SUBPROJECTLIST (SUBPROJECT+)>
<!ELEMENT SUBPROJECT (FILEREF, SUBPROJECTTARGETLIST)>
<!ELEMENT SUBPROJECTTARGETLIST (SUBPROJECTTARGET*)>
<!ELEMENT SUBPROJECTTARGET (TARGETNAME, ATTRIBUTES?, FILEREF?)>
<!ELEMENT FRAMEWORKLIST (FRAMEWORK+)>
<!ELEMENT FRAMEWORK (FILEREF, LIBRARYFILE?, VERSION?)>
<!ELEMENT LIBRARYFILE (FILEREF)>
<!ELEMENT VERSION (#PCDATA)>
<!ELEMENT TARGETORDER (ORDEREDTARGET|ORDEREDDESIGN)*>
<!ELEMENT ORDEREDTARGET (NAME)>
<!ELEMENT ORDEREDDESIGN (NAME, ORDEREDTARGET+)>
<!ELEMENT GROUPLIST (GROUP|FILEREF)*>
<!ELEMENT GROUP (NAME, (GROUP|FILEREF)*)>
<!ELEMENT DESIGNLIST (DESIGN+)>
<!ELEMENT DESIGN (NAME, DESIGNDATA)>
<!ELEMENT DESIGNDATA (#PCDATA)>
]>

<PROJECT>
    <TARGETLIST>
        <TARGET>
            <NAME>DebugRel</NAME>
            <SETTINGLIST>

                <!-- Settings for "Source Trees" panel -->
                <SETTING><NAME>UserSourceTrees</NAME><VALUE></VALUE></SETTING>

                <!-- Settings for "Access Paths" panel -->
                <SETTING><NAME>AlwaysSearchUserPaths</NAME><VALUE>false</VALUE></SETTING>
                <SETTING><NAME>InterpretDOSAndUnixPaths</NAME><VALUE>false</VALUE></SETTING>
                <SETTING><NAME>RequireFrameworkStyleIncludes</NAME><VALUE>false</VALUE></SETTING>
                <SETTING><NAME>UserSearchPaths</NAME>
                    <SETTING>
                        <SETTING><NAME>SearchPath</NAME>
                            <SETTING><NAME>Path</NAME><VALUE></VALUE></SETTING>
                            <SETTING><NAME>PathFormat</NAME><VALUE>Windows</VALUE></SETTING>
                            <SETTING><NAME>PathRoot</NAME><VALUE>Project</VALUE></SETTING>
                        </SETTING>
                        <SETTING><NAME>Recursive</NAME><VALUE>true</VALUE></SETTING>
                        <SETTING><NAME>FrameworkPath</NAME><VALUE>false</VALUE></SETTING>
                        <SETTING><NAME>HostFlags</NAME><VALUE>All</VALUE></SETTING>
                    </SETTING>
                </SETTING>
                <SETTING><NAME>SystemSearchPaths</NAME>
                    <SETTING>
                        <SETTING><NAME>SearchPath</NAME>
                            <SETTING><NAME>Path</NAME><VALUE>include</VALUE></SETTING>
                            <SETTING><NAME>PathFormat</NAME><VALUE>Windows</VALUE></SETTING>
                            <SETTING><NAME>PathRoot</NAME><VALUE>CodeWarrior</VALUE></SETTING>
                        </SETTING>
                        <SETTING><NAME>Recursive</NAME><VALUE>false</VALUE></SETTING>
                        <SETTING><NAME>FrameworkPath</NAME><VALUE>false</VALUE></SETTING>
                        <SETTING><NAME>HostFlags</NAME><VALUE>All</VALUE></SETTING>
                    </SETTING>
                    <SETTING>
                        <SETTING><NAME>SearchPath</NAME>
                            <SETTING><NAME>Path</NAME><VALUE>lib</VALUE></SETTING>
                            <SETTING><NAME>PathFormat</NAME><VALUE>Windows</VALUE></SETTING>
                            <SETTING><NAME>PathRoot</NAME><VALUE>CodeWarrior</VALUE></SETTING>
                        </SETTING>
                        <SETTING><NAME>Recursive</NAME><VALUE>false</VALUE></SETTING>
                        <SETTING><NAME>FrameworkPath</NAME><VALUE>false</VALUE></SETTING>
                        <SETTING><NAME>HostFlags</NAME><VALUE>All</VALUE></SETTING>
                    </SETTING>
                </SETTING>

                <!-- Settings for "Debugger Runtime" panel -->
                <SETTING><NAME>MWRuntimeSettings_WorkingDirectory</NAME><VALUE></VALUE></SETTING>
                <SETTING><NAME>MWRuntimeSettings_CommandLine</NAME><VALUE></VALUE></SETTING>
                <SETTING><NAME>MWRuntimeSettings_HostApplication</NAME>
                    <SETTING><NAME>Path</NAME><VALUE></VALUE></SETTING>
                    <SETTING><NAME>PathFormat</NAME><VALUE>Generic</VALUE></SETTING>
                    <SETTING><NAME>PathRoot</NAME><VALUE>Absolute</VALUE></SETTING>
                </SETTING>
                <SETTING><NAME>MWRuntimeSettings_EnvVars</NAME><VALUE></VALUE></SETTING>

                <!-- Settings for "Target Settings" panel -->
                <SETTING><NAME>Linker</NAME><VALUE>ARM Linker</VALUE></SETTING>
                <SETTING><NAME>PreLinker</NAME><VALUE></VALUE></SETTING>
                <SETTING><NAME>PostLinker</NAME><VALUE>ARM fromELF</VALUE></SETTING>
                <SETTING><NAME>Targetname</NAME><VALUE>DebugRel</VALUE></SETTING>
                <SETTING><NAME>OutputDirectory</NAME>
                    <SETTING><NAME>Path</NAME><VALUE></VALUE></SETTING>
                    <SETTING><NAME>PathFormat</NAME><VALUE>Windows</VALUE></SETTING>
                    <SETTING><NAME>PathRoot</NAME><VALUE>Project</VALUE></SETTING>
                </SETTING>
                <SETTING><NAME>SaveEntriesUsingRelativePaths</NAME><VALUE>false</VALUE></SETTING>

                <!-- Settings for "File Mappings" panel -->
                <SETTING><NAME>FileMappings</NAME>
                    <SETTING>
                        <SETTING><NAME>FileType</NAME><VALUE>TEXT</VALUE></SETTING>
                        <SETTING><NAME>FileExtension</NAME><VALUE>.c</VALUE></SETTING>
                        <SETTING><NAME>Compiler</NAME><VALUE>ARM C Compiler</VALUE></SETTING>
                        <SETTING><NAME>EditLanguage</NAME><VALUE>C/C++</VALUE></SETTING>
                        <SETTING><NAME>Precompile</NAME><VALUE>false</VALUE></SETTING>
                        <SETTING><NAME>Launchable</NAME><VALUE>false</VALUE></SETTING>
                        <SETTING><NAME>ResourceFile</NAME><VALUE>false</VALUE></SETTING>
                        <SETTING><NAME>IgnoredByMake</NAME><VALUE>false</VALUE></SETTING>
                    </SETTING>
                    <SETTING>
                        <SETTING><NAME>FileType</NAME><VALUE>TEXT</VALUE></SETTING>
                        <SETTING><NAME>FileExtension</NAME><VALUE>.cc</VALUE></SETTING>
                        <SETTING><NAME>Compiler</NAME><VALUE>ARM C++ Compiler</VALUE></SETTING>
                        <SETTING><NAME>EditLanguage</NAME><VALUE>C/C++</VALUE></SETTING>
                        <SETTING><NAME>Precompile</NAME><VALUE>false</VALUE></SETTING>
                        <SETTING><NAME>Launchable</NAME><VALUE>false</VALUE></SETTING>
                        <SETTING><NAME>ResourceFile</NAME><VALUE>false</VALUE></SETTING>
                        <SETTING><NAME>IgnoredByMake</NAME><VALUE>false</VALUE></SETTING>
                    </SETTING>
                    <SETTING>
                        <SETTING><NAME>FileType</NAME><VALUE>TEXT</VALUE></SETTING>
                        <SETTING><NAME>FileExtension</NAME><VALUE>.cpp</VALUE></SETTING>
                        <SETTING><NAME>Compiler</NAME><VALUE>ARM C++ Compiler</VALUE></SETTING>
                        <SETTING><NAME>EditLanguage</NAME><VALUE>C/C++</VALUE></SETTING>
                        <SETTING><NAME>Precompile</NAME><VALUE>false</VALUE></SETTING>
                        <SETTING><NAME>Launchable</NAME><VALUE>false</VALUE></SETTING>
                        <SETTING><NAME>ResourceFile</NAME><VALUE>false</VALUE></SETTING>
                        <SETTING><NAME>IgnoredByMake</NAME><VALUE>false</VALUE></SETTING>
                    </SETTING>
                    <SETTING>
                        <SETTING><NAME>FileType</NAME><VALUE>TEXT</VALUE></SETTING>
                        <SETTING><NAME>FileExtension</NAME><VALUE>.h</VALUE></SETTING>
                        <SETTING><NAME>Compiler</NAME><VALUE>ARM C Compiler</VALUE></SETTING>
                        <SETTING><NAME>EditLanguage</NAME><VALUE>C/C++</VALUE></SETTING>
                        <SETTING><NAME>Precompile</NAME><VALUE>false</VALUE></SETTING>
                        <SETTING><NAME>Launchable</NAME><VALUE>false</VALUE></SETTING>
                        <SETTING><NAME>ResourceFile</NAME><VALUE>false</VALUE></SETTING>
                        <SETTING><NAME>IgnoredByMake</NAME><VALUE>true</VALUE></SETTING>
                    </SETTING>
                    <SETTING>
                        <SETTING><NAME>FileType</NAME><VALUE>TEXT</VALUE></SETTING>
                        <SETTING><NAME>FileExtension</NAME><VALUE>.hpp</VALUE></SETTING>
                        <SETTING><NAME>Compiler</NAME><VALUE>ARM C++ Compiler</VALUE></SETTING>
                        <SETTING><NAME>EditLanguage</NAME><VALUE>C/C++</VALUE></SETTING>
                        <SETTING><NAME>Precompile</NAME><VALUE>false</VALUE></SETTING>
                        <SETTING><NAME>Launchable</NAME><VALUE>false</VALUE></SETTING>
                        <SETTING><NAME>ResourceFile</NAME><VALUE>false</VALUE></SETTING>
                        <SETTING><NAME>IgnoredByMake</NAME><VALUE>true</VALUE></SETTING>
                    </SETTING>
                    <SETTING>
                        <SETTING><NAME>FileType</NAME><VALUE>TEXT</VALUE></SETTING>
                        <SETTING><NAME>FileExtension</NAME><VALUE>.s</VALUE></SETTING>
                        <SETTING><NAME>Compiler</NAME><VALUE>ARM Assembler</VALUE></SETTING>
                        <SETTING><NAME>EditLanguage</NAME><VALUE>C/C++</VALUE></SETTING>
                        <SETTING><NAME>Precompile</NAME><VALUE>false</VALUE></SETTING>
                        <SETTING><NAME>Launchable</NAME><VALUE>false</VALUE></SETTING>
                        <SETTING><NAME>ResourceFile</NAME><VALUE>false</VALUE></SETTING>
                        <SETTING><NAME>IgnoredByMake</NAME><VALUE>false</VALUE></SETTING>
                    </SETTING>
                    <SETTING>
                        <SETTING><NAME>FileType</NAME><VALUE>TEXT</VALUE></SETTING>
                        <SETTING><NAME>FileExtension</NAME><VALUE>.scf</VALUE></SETTING>
                        <SETTING><NAME>Compiler</NAME><VALUE></VALUE></SETTING>
                        <SETTING><NAME>EditLanguage</NAME><VALUE>C/C++</VALUE></SETTING>
                        <SETTING><NAME>Precompile</NAME><VALUE>false</VALUE></SETTING>
                        <SETTING><NAME>Launchable</NAME><VALUE>false</VALUE></SETTING>
                        <SETTING><NAME>ResourceFile</NAME><VALUE>false</VALUE></SETTING>
                        <SETTING><NAME>IgnoredByMake</NAME><VALUE>false</VALUE></SETTING>
                    </SETTING>
                    <SETTING>
                        <SETTING><NAME>FileType</NAME><VALUE>TEXT</VALUE></SETTING>
                        <SETTING><NAME>FileExtension</NAME><VALUE>.txt</VALUE></SETTING>
                        <SETTING><NAME>Compiler</NAME><VALUE></VALUE></SETTING>
                        <SETTING><NAME>EditLanguage</NAME><VALUE>C/C++</VALUE></SETTING>
                        <SETTING><NAME>Precompile</NAME><VALUE>false</VALUE></SETTING>
                        <SETTING><NAME>Launchable</NAME><VALUE>false</VALUE></SETTING>
                        <SETTING><NAME>ResourceFile</NAME><VALUE>false</VALUE></SETTING>
                        <SETTING><NAME>IgnoredByMake</NAME><VALUE>true</VALUE></SETTING>
                    </SETTING>
                    <SETTING>
                        <SETTING><NAME>FileExtension</NAME><VALUE>.a</VALUE></SETTING>
                        <SETTING><NAME>Compiler</NAME><VALUE>ARM ELF Importer</VALUE></SETTING>
                        <SETTING><NAME>EditLanguage</NAME><VALUE></VALUE></SETTING>
                        <SETTING><NAME>Precompile</NAME><VALUE>false</VALUE></SETTING>
                        <SETTING><NAME>Launchable</NAME><VALUE>false</VALUE></SETTING>
                        <SETTING><NAME>ResourceFile</NAME><VALUE>false</VALUE></SETTING>
                        <SETTING><NAME>IgnoredByMake</NAME><VALUE>false</VALUE></SETTING>
                    </SETTING>
                    <SETTING>
                        <SETTING><NAME>FileExtension</NAME><VALUE>.alf</VALUE></SETTING>
                        <SETTING><NAME>Compiler</NAME><VALUE>ARM ELF Importer</VALUE></SETTING>
                        <SETTING><NAME>EditLanguage</NAME><VALUE></VALUE></SETTING>
                        <SETTING><NAME>Precompile</NAME><VALUE>false</VALUE></SETTING>
                        <SETTING><NAME>Launchable</NAME><VALUE>false</VALUE></SETTING>
                        <SETTING><NAME>ResourceFile</NAME><VALUE>false</VALUE></SETTING>
                        <SETTING><NAME>IgnoredByMake</NAME><VALUE>false</VALUE></SETTING>
                    </SETTING>
                    <SETTING>
                        <SETTING><NAME>FileExtension</NAME><VALUE>.lib</VALUE></SETTING>
                        <SETTING><NAME>Compiler</NAME><VALUE>ARM ELF Importer</VALUE></SETTING>
                        <SETTING><NAME>EditLanguage</NAME><VALUE></VALUE></SETTING>
                        <SETTING><NAME>Precompile</NAME><VALUE>false</VALUE></SETTING>
                        <SETTING><NAME>Launchable</NAME><VALUE>false</VALUE></SETTING>
                        <SETTING><NAME>ResourceFile</NAME><VALUE>false</VALUE></SETTING>
                        <SETTING><NAME>IgnoredByMake</NAME><VALUE>false</VALUE></SETTING>
                    </SETTING>
                    <SETTING>
                        <SETTING><NAME>FileExtension</NAME><VALUE>.o</VALUE></SETTING>
                        <SETTING><NAME>Compiler</NAME><VALUE>ARM ELF Importer</VALUE></SETTING>
                        <SETTING><NAME>EditLanguage</NAME><VALUE></VALUE></SETTING>
                        <SETTING><NAME>Precompile</NAME><VALUE>false</VALUE></SETTING>
                        <SETTING><NAME>Launchable</NAME><VALUE>false</VALUE></SETTING>
                        <SETTING><NAME>ResourceFile</NAME><VALUE>false</VALUE></SETTING>
                        <SETTING><NAME>IgnoredByMake</NAME><VALUE>false</VALUE></SETTING>
                    </SETTING>
                </SETTING>

                <!-- Settings for "Build Extras" panel -->
                <SETTING><NAME>CacheModDates</NAME><VALUE>true</VALUE></SETTING>
                <SETTING><NAME>ActivateBrowser</NAME><VALUE>true</VALUE></SETTING>
                <SETTING><NAME>DumpBrowserInfo</NAME><VALUE>false</VALUE></SETTING>
                <SETTING><NAME>CacheSubprojects</NAME><VALUE>true</VALUE></SETTING>
                <SETTING><NAME>UseThirdPartyDebugger</NAME><VALUE>false</VALUE></SETTING>
                <SETTING><NAME>DebuggerAppPath</NAME>
                    <SETTING><NAME>Path</NAME><VALUE></VALUE></SETTING>
                    <SETTING><NAME>PathFormat</NAME><VALUE>Generic</VALUE></SETTING>
                    <SETTING><NAME>PathRoot</NAME><VALUE>Absolute</VALUE></SETTING>
                </SETTING>
                <SETTING><NAME>DebuggerCmdLineArgs</NAME><VALUE></VALUE></SETTING>
                <SETTING><NAME>DebuggerWorkingDir</NAME>
                    <SETTING><NAME>Path</NAME><VALUE></VALUE></SETTING>
                    <SETTING><NAME>PathFormat</NAME><VALUE>Generic</VALUE></SETTING>
                    <SETTING><NAME>PathRoot</NAME><VALUE>Absolute</VALUE></SETTING>
                </SETTING>

                <!-- Settings for "Debugger Target" panel -->
                <SETTING><NAME>LogSystemMessages</NAME><VALUE>true</VALUE></SETTING>
                <SETTING><NAME>AutoTargetDLLs</NAME><VALUE>false</VALUE></SETTING>
                <SETTING><NAME>StopAtWatchpoints</NAME><VALUE>true</VALUE></SETTING>
                <SETTING><NAME>PauseWhileRunning</NAME><VALUE>false</VALUE></SETTING>
                <SETTING><NAME>PauseInterval</NAME><VALUE>5</VALUE></SETTING>
                <SETTING><NAME>PauseUIFlags</NAME><VALUE>0</VALUE></SETTING>
                <SETTING><NAME>AltExePath</NAME>
                    <SETTING><NAME>Path</NAME><VALUE></VALUE></SETTING>
                    <SETTING><NAME>PathFormat</NAME><VALUE>Generic</VALUE></SETTING>
                    <SETTING><NAME>PathRoot</NAME><VALUE>Absolute</VALUE></SETTING>
                </SETTING>
                <SETTING><NAME>StopAtTempBPOnLaunch</NAME><VALUE>true</VALUE></SETTING>
                <SETTING><NAME>CacheSymbolics</NAME><VALUE>true</VALUE></SETTING>
                <SETTING><NAME>TempBPFunctionName</NAME><VALUE>main</VALUE></SETTING>
                <SETTING><NAME>TempBPType</NAME><VALUE>0</VALUE></SETTING>

                <!-- Settings for "Remote Debug" panel -->
                <SETTING><NAME>Enabled</NAME><VALUE>true</VALUE></SETTING>
                <SETTING><NAME>ConnectionName</NAME><VALUE></VALUE></SETTING>
                <SETTING><NAME>DownloadPath</NAME><VALUE></VALUE></SETTING>
                <SETTING><NAME>LaunchRemoteApp</NAME><VALUE>false</VALUE></SETTING>
                <SETTING><NAME>RemoteAppPath</NAME><VALUE></VALUE></SETTING>

                <!-- Settings for "Auto-target" panel -->
                <SETTING><NAME>OtherExecutables</NAME><VALUE></VALUE></SETTING>

                <!-- Settings for "Custom Keywords" panel -->
                <SETTING><NAME>CustomColor1</NAME>
                    <SETTING><NAME>Red</NAME><VALUE>0</VALUE></SETTING>
                    <SETTING><NAME>Green</NAME><VALUE>32767</VALUE></SETTING>
                    <SETTING><NAME>Blue</NAME><VALUE>0</VALUE></SETTING>
                </SETTING>
                <SETTING><NAME>CustomColor2</NAME>
                    <SETTING><NAME>Red</NAME><VALUE>0</VALUE></SETTING>
                    <SETTING><NAME>Green</NAME><VALUE>32767</VALUE></SETTING>
                    <SETTING><NAME>Blue</NAME><VALUE>0</VALUE></SETTING>
                </SETTING>
                <SETTING><NAME>CustomColor3</NAME>
                    <SETTING><NAME>Red</NAME><VALUE>0</VALUE></SETTING>
                    <SETTING><NAME>Green</NAME><VALUE>32767</VALUE></SETTING>
                    <SETTING><NAME>Blue</NAME><VALUE>0</VALUE></SETTING>
                </SETTING>
                <SETTING><NAME>CustomColor4</NAME>
                    <SETTING><NAME>Red</NAME><VALUE>0</VALUE></SETTING>
                    <SETTING><NAME>Green</NAME><VALUE>32767</VALUE></SETTING>
                    <SETTING><NAME>Blue</NAME><VALUE>0</VALUE></SETTING>
                </SETTING>
                <PANELDATA><NAME>Panel_for_armasm</NAME><VALUE>
                    0300000000000000000000000000000000000000000000000000000000000000
                    0000000000000000000000000000000000000000000000000000000000000000
                    0000000000000000000000000000000000000000000000000000000000000000
                    0000000000000000000000000000000000000000000000000000000000000000
                    0000000000000000000000000000000000000000000000000000000000000000
                    0000000000000000000000000000000000000000000000000000000000000000
                    0000000000000000000000000000000000000000000000000000000000000000
                    0000000000000000000000000000000000000000000000000000000000000000
                    0000000041524D20417373656D626C6572000000000000000000000000000000
                    0000000000000000000000000000000000000000000000000000000000000000
                    0000000000000000000000000000000000000000000000000000000000000000
                    0000000000000000000000000000000000000000000000000000000000000000
                    0000000000000000000000000000000000000000000000000000000000000000
                    0000000000000000000000000000000000000000000000000000000000000000
                    0000000000000000000000000000000000000000000000000000000000000000
                    0000000000000000000000000000000000000000000000000000000000000000
                    0000000041524D20417373656D626C6572000000000000000000000000000000
                    0000000000000000000000000000000000000000000000000000000000000000
                    0000000000000000000000000000000000000000000000000000000000000000
                    0000000000000000000000000000000000000000000000000000000000000000
                    0000000000000000000000000000000000000000000000000000000000000000
                    0000000000000000000000000000000000000000000000000000000000000000
                    0000000000000000000000000000000000000000000000000000000000000000
                    0000000000000000000000000000000000000000000000000000000000000000
                    0000000000000000000000000000000000000000000000000000000000000000
                    0000000000000000000000000000000000000000000000000000000000000000
                    0000000000000000000000000000000000000000000000000000000000000000
                    0000000000000000000000000000000000000000000000000000000000000000
                    0000000000000000000000000000000000000000000000000000000000000000
                    0000000000000000000000000000000000000000000000000000000000000000
                    0000000000000000000000000000000000000000000000000000000000000000
                    0000000000000000000000000000000000000000000000000000000000000000
                    0000000000000000000000000000000000000000000000000000000000000000
                    0000000000000000000000000000000000000000000000000000000000000000
                    0000000000000000000000000000000000000000000000000000000000000000
                    0000000000000000000000000000000000000000000000000000000000000000
                    0000000000000000000000000000000000000000000000000000000000000000
                    0000000000000000000000000000000000000000000000000000000000000000
                    0000000000000000000000000000000000000000000000000000000000000000
                    0000000000000000000000000000000000000000000000000000000000000000
                    0000000000000000000000000000000000000000000000000000000000000000
                    0000000000000000000000000000000000000000000000000000000000000000
                    0000000000000000000000000000000000000000000000000000000000000000
                    0000000000000000000000000000000000000000000000000000000000000000
                    0000000000000000000000000000000000000000000000000000000000000000
                    0000000000000000000000000000000000000000000000000000000000000000
                    0000000000000000000000000000000000000000000000000000000000000000
                    0000000000000000000000000000000000000000000000000000000000000000
                    0000000000000000000000000000000000000000000000000000000000000000
                    0000000000000000000000000000000000000000000000000000000000000000
                    0000000000000000000000000000000000000000000000000000000000000000
                    0000000000000000000000000000000000000000000000000000000000000000
                    0000000000000000000000000000000000000000000000000000000000000000
                    0000000000000000000000000000000000000000000000000000000000000000
                    0000000000000000000000000000000000000000000000000000000000000000
                    0000000000000000000000000000000000000000000000000000000000000000
                    0000000000000000000000000000000000000000000000000000000000000000
                    0000000000000000000000000000000000000000000000000000000000000000
                    0000000000000000000000000000000000000000000000000000000000000000
                    0000000000000000000000000000000000000000000000000000000000000000
                    0000000000000000000000000000000000000000000000000000000000000000
                    0000000000000000000000000000000000000000000000000000000000000000
                    0000000000000000000000000000000000000000000000000000000000000000
                    0000000000000000000000000000000000000000000000000000000000000000
                    000000002D667075234E6F6E650A2E6B6565703D2D6B6565700A2D6370752341
                    524D393230540A2D617063732E696E746572232F696E746572776F726B0A2E64
                    656275673D2D670A00
                </VALUE></PANELDATA>
                <PANELDATA><NAME>Panel_for_armcc</NAME><VALUE>
                    0300000000000000000000000000000000000000000000000000000000000000
                    0000000000000000000000000000000000000000000000000000000000000000
                    0000000000000000000000000000000000000000000000000000000000000000
                    0000000000000000000000000000000000000000000000000000000000000000
                    0000000000000000000000000000000000000000000000000000000000000000
                    0000000000000000000000000000000000000000000000000000000000000000
                    0000000000000000000000000000000000000000000000000000000000000000
                    0000000000000000000000000000000000000000000000000000000000000000
                    0000000041524D204320436F6D70696C65720000000000000000000000000000
                    0000000000000000000000000000000000000000000000000000000000000000
                    0000000000000000000000000000000000000000000000000000000000000000
                    0000000000000000000000000000000000000000000000000000000000000000
                    0000000000000000000000000000000000000000000000000000000000000000
                    0000000000000000000000000000000000000000000000000000000000000000
                    0000000000000000000000000000000000000000000000000000000000000000
                    0000000000000000000000000000000000000000000000000000000000000000
                    0000000041524D204320436F6D70696C65720000000000000000000000000000
                    0000000000000000000000000000000000000000000000000000000000000000
                    0000000000000000000000000000000000000000000000000000000000000000
                    0000000000000000000000000000000000000000000000000000000000000000
                    0000000000000000000000000000000000000000000000000000000000000000
                    0000000000000000000000000000000000000000000000000000000000000000
                    0000000000000000000000000000000000000000000000000000000000000000
                    0000000000000000000000000000000000000000000000000000000000000000
                    0000000000000000000000000000000000000000000000000000000000000000
                    0000000000000000000000000000000000000000000000000000000000000000
                    0000000000000000000000000000000000000000000000000000000000000000
                    0000000000000000000000000000000000000000000000000000000000000000
                    0000000000000000000000000000000000000000000000000000000000000000
                    0000000000000000000000000000000000000000000000000000000000000000
                    0000000000000000000000000000000000000000000000000000000000000000
                    0000000000000000000000000000000000000000000000000000000000000000
                    0000000000000000000000000000000000000000000000000000000000000000
                    0000000000000000000000000000000000000000000000000000000000000000
                    0000000000000000000000000000000000000000000000000000000000000000
                    0000000000000000000000000000000000000000000000000000000000000000
                    0000000000000000000000000000000000000000000000000000000000000000
                    0000000000000000000000000000000000000000000000000000000000000000
                    0000000000000000000000000000000000000000000000000000000000000000
                    0000000000000000000000000000000000000000000000000000000000000000
                    0000000000000000000000000000000000000000000000000000000000000000
                    0000000000000000000000000000000000000000000000000000000000000000
                    0000000000000000000000000000000000000000000000000000000000000000
                    0000000000000000000000000000000000000000000000000000000000000000
                    0000000000000000000000000000000000000000000000000000000000000000
                    0000000000000000000000000000000000000000000000000000000000000000